{
  "kind": "AgentCard",
  "version": "1.0.0",
  "owner": "Synthetic delivery controls group",
  "status": "APPROVED",
  "inputSchema": { "$ref": "/capabilities/schemas/stage-input.schema.json" },
  "outputSchema": { "$ref": "/capabilities/schemas/stage-output.schema.json" },
  "modelPolicyId": "model.policy.delivery-balanced",
  "memoryPolicyId": "memory.policy.review-bounded",
  "approvalPolicyIds": ["policy.registry.separation-of-duties"],
  "maxDurationMs": 120000,
  "maxToolCalls": 6,
  "maxRepairAttempts": 0,
  "tokenBudget": { "maxInputTokens": 9000, "maxOutputTokens": 3000, "basis": "ESTIMATED" },
  "costBudget": { "maxEstimatedUsd": 0.35, "basis": "ESTIMATED" },
  "sourceCommit": "ce90338bae56ebe2850aca506ee28b6646eac9e3",
  "createdAt": "2026-07-16T18:00:00.000Z",
  "updatedAt": "2026-07-16T18:00:00.000Z",
  "approval": {
    "approvedBy": "Synthetic control reviewer",
    "approvedAt": "2026-07-16T19:00:00.000Z",
    "approvalPolicyId": "policy.registry.separation-of-duties",
    "decisionRecordId": "decision.synthetic.registry-v1"
  },
  "id": "agent.review-assistant",
  "name": "Review Assistant",
  "description": "Summarizes the tested diff and flags risk; it cannot grant, record, or substitute for human approval.",
  "stageId": "review",
  "capabilities": ["diff summary", "risk flagging", "evidence cross-check"],
  "skills": ["review preparation", "acceptance evidence comparison"],
  "allowedToolIds": ["tool.repository.diff.inspect", "tool.evidence.write"],
  "allowedWritePaths": ["browser-local://evidence/review-summary.json"],
  "contentHash": "cb296c571145e011866d200706c738aa91baa0f42d5da05b85a8ffb3166ad2ad"
}
