{
  "kind": "AgentCard",
  "version": "1.0.0",
  "owner": "Synthetic delivery controls group",
  "status": "APPROVED",
  "inputSchema": { "$ref": "/capabilities/schemas/stage-input.schema.json" },
  "outputSchema": { "$ref": "/capabilities/schemas/stage-output.schema.json" },
  "modelPolicyId": "model.policy.delivery-balanced",
  "memoryPolicyId": "memory.policy.issue-bounded",
  "approvalPolicyIds": ["policy.registry.separation-of-duties"],
  "maxDurationMs": 120000,
  "maxToolCalls": 12,
  "maxRepairAttempts": 2,
  "tokenBudget": { "maxInputTokens": 9000, "maxOutputTokens": 3000, "basis": "ESTIMATED" },
  "costBudget": { "maxEstimatedUsd": 0.35, "basis": "ESTIMATED" },
  "sourceCommit": "6ff396739f4f8afbf7af966e202a45a00eb0eeaa",
  "createdAt": "2026-07-16T18:00:00.000Z",
  "updatedAt": "2026-07-16T18:00:00.000Z",
  "approval": {
    "approvedBy": "Synthetic control reviewer",
    "approvedAt": "2026-07-16T19:00:00.000Z",
    "approvalPolicyId": "policy.registry.separation-of-duties",
    "decisionRecordId": "decision.synthetic.registry-v1"
  },
  "id": "agent.planning",
  "name": "Planning Agent",
  "description": "Emits an ordered implementation plan with risks and verification steps.",
  "stageId": "plan",
  "capabilities": ["task decomposition", "risk analysis", "verification planning"],
  "skills": ["change sequencing", "dependency inspection"],
  "allowedToolIds": ["tool.issue.read", "tool.repository.search", "tool.repository.file.read"],
  "allowedWritePaths": ["artifacts/plan.md"],
  "contentHash": "b5752f84018982c0c7b9119b210a92da38aa2b033902d0ebfdbafd6c988109a1"
}
