{
  "kind": "AgentCard",
  "version": "1.0.0",
  "owner": "Synthetic delivery controls group",
  "status": "APPROVED",
  "inputSchema": { "$ref": "/capabilities/schemas/stage-input.schema.json" },
  "outputSchema": { "$ref": "/capabilities/schemas/stage-output.schema.json" },
  "modelPolicyId": "model.policy.delivery-balanced",
  "memoryPolicyId": "memory.policy.issue-bounded",
  "approvalPolicyIds": ["policy.registry.separation-of-duties"],
  "maxDurationMs": 120000,
  "maxToolCalls": 2,
  "maxRepairAttempts": 2,
  "tokenBudget": { "maxInputTokens": 9000, "maxOutputTokens": 3000, "basis": "ESTIMATED" },
  "costBudget": { "maxEstimatedUsd": 0.35, "basis": "ESTIMATED" },
  "sourceCommit": "6ff396739f4f8afbf7af966e202a45a00eb0eeaa",
  "createdAt": "2026-07-16T18:00:00.000Z",
  "updatedAt": "2026-07-16T18:00:00.000Z",
  "approval": {
    "approvedBy": "Synthetic control reviewer",
    "approvedAt": "2026-07-16T19:00:00.000Z",
    "approvalPolicyId": "policy.registry.separation-of-duties",
    "decisionRecordId": "decision.synthetic.registry-v1"
  },
  "id": "agent.intake",
  "name": "Intake Agent",
  "description": "Normalizes one synthetic issue into a bounded intake artifact.",
  "stageId": "intake",
  "capabilities": ["issue normalization", "scope extraction", "ambiguity flagging"],
  "skills": ["structured intake", "risk cue extraction"],
  "allowedToolIds": ["tool.issue.read"],
  "allowedWritePaths": ["artifacts/intake.json"],
  "contentHash": "a7753b06581036ea8d9e514a9c72744a8d6eeba9ea5de4eb2831796da3318837"
}
