{
  "kind": "AgentCard",
  "version": "1.0.0",
  "owner": "Synthetic delivery controls group",
  "status": "APPROVED",
  "inputSchema": { "$ref": "/capabilities/schemas/stage-input.schema.json" },
  "outputSchema": { "$ref": "/capabilities/schemas/stage-output.schema.json" },
  "modelPolicyId": "model.policy.delivery-balanced",
  "memoryPolicyId": "memory.policy.issue-bounded",
  "approvalPolicyIds": ["policy.registry.separation-of-duties", "policy.sandbox.validation-notify"],
  "maxDurationMs": 120000,
  "maxToolCalls": 12,
  "maxRepairAttempts": 2,
  "tokenBudget": { "maxInputTokens": 9000, "maxOutputTokens": 3000, "basis": "ESTIMATED" },
  "costBudget": { "maxEstimatedUsd": 0.35, "basis": "ESTIMATED" },
  "sourceCommit": "6ff396739f4f8afbf7af966e202a45a00eb0eeaa",
  "createdAt": "2026-07-16T18:00:00.000Z",
  "updatedAt": "2026-07-16T18:00:00.000Z",
  "approval": {
    "approvedBy": "Synthetic control reviewer",
    "approvedAt": "2026-07-16T19:00:00.000Z",
    "approvalPolicyId": "policy.registry.separation-of-duties",
    "decisionRecordId": "decision.synthetic.registry-v1"
  },
  "id": "agent.verification",
  "name": "Verification Agent",
  "description": "Runs the fixed local validation command and records synthetic evidence.",
  "stageId": "verify",
  "capabilities": [
    "fixed-command validation",
    "diff-to-evidence linkage",
    "failure classification"
  ],
  "skills": ["test interpretation", "evidence packaging"],
  "allowedToolIds": [
    "tool.repository.file.read",
    "tool.sandbox.command",
    "tool.repository.diff.inspect",
    "tool.evidence.write"
  ],
  "allowedWritePaths": ["browser-local://evidence/**"],
  "contentHash": "73e69bded166fad74514151fb839cc7566cf84eb7a83079dbebe1d39a3fb2a41"
}
